{
  "$schema": "../../schemas/techniques.glossary.schema.json",
  "schemaVersion": "1.0.0",
  "updatedAt": "2026-01-13",
  "notes": [
    "SSA Techniques Glossary (shared across cuisines).",
    "Purpose: canonical technique IDs + plain-language definitions + aliases to support recipe parsing, UI tooltips, and skill-building.",
    "IDs are stable; do not rename IDs once shipped. Add new items instead.",
    "Aliases should be lowercased phrases as they appear in recipes; the app should normalize text before matching.",
    "This glossary is cuisine-agnostic. Cuisine-specific variants belong in cuisine profiles/rulesets."
  ],
  "meta": {
    "id": "cuisines_shared.techniques.glossary",
    "type": "glossary",
    "domain": "techniques",
    "locale": "en-US",
    "normalization": {
      "case": "lower",
      "trim": true,
      "collapseWhitespace": true,
      "stripPunctuation": true
    }
  },
  "techniques": [
    {
      "id": "prep_mise_en_place",
      "label": "Mise en place",
      "category": "prep",
      "difficulty": "beginner",
      "definition": "Prepare and organize all ingredients and tools before cooking (measured, chopped, and ready).",
      "why_it_matters": "Reduces mistakes and keeps cooking smooth when timing matters.",
      "common_tools": [
        "knife",
        "cutting_board",
        "bowls",
        "measuring_spoons",
        "measuring_cups",
        "scale"
      ],
      "signals_of_success": [
        "ingredients portioned",
        "tools staged",
        "no scrambling during cooking"
      ],
      "common_mistakes": [
        "starting heat before prep",
        "forgetting to measure spices or liquids"
      ],
      "aliases": [
        "mise en place",
        "mise",
        "prep station",
        "set up ingredients"
      ],
      "tags": ["organization", "timing", "workflow"]
    },
    {
      "id": "prep_chop",
      "label": "Chop",
      "category": "prep",
      "difficulty": "beginner",
      "definition": "Cut ingredients into roughly uniform pieces (size varies by recipe).",
      "why_it_matters": "Even pieces cook at the same rate and give consistent texture.",
      "common_tools": ["knife", "cutting_board"],
      "signals_of_success": [
        "mostly uniform pieces",
        "minimal crushing",
        "clean cuts"
      ],
      "common_mistakes": ["uneven sizes", "dull knife causing tearing"],
      "aliases": ["chop", "rough chop", "coarsely chop", "chopped"],
      "tags": ["knife_skills", "even_cooking"]
    },
    {
      "id": "prep_dice",
      "label": "Dice",
      "category": "prep",
      "difficulty": "beginner",
      "definition": "Cut food into small cubes of fairly even size.",
      "why_it_matters": "Even cubes cook evenly and distribute through the dish.",
      "common_tools": ["knife", "cutting_board"],
      "signals_of_success": ["even cubes", "consistent size within a batch"],
      "common_mistakes": ["mixing large and small pieces"],
      "aliases": ["dice", "diced", "small dice", "medium dice", "large dice"],
      "tags": ["knife_skills", "even_cooking"]
    },
    {
      "id": "prep_mince",
      "label": "Mince",
      "category": "prep",
      "difficulty": "beginner",
      "definition": "Chop very finely into tiny pieces (often garlic, ginger, herbs).",
      "why_it_matters": "Releases aroma quickly and disperses flavor evenly.",
      "common_tools": ["knife", "cutting_board"],
      "signals_of_success": ["very small pieces", "fragrant aroma released"],
      "common_mistakes": [
        "smashing into paste unintentionally",
        "uneven pieces"
      ],
      "aliases": ["mince", "minced", "finely chop", "finely chopped"],
      "tags": ["knife_skills", "flavor_release"]
    },
    {
      "id": "prep_julienne",
      "label": "Julienne",
      "category": "prep",
      "difficulty": "intermediate",
      "definition": "Cut into thin matchstick strips.",
      "why_it_matters": "Creates quick-cooking pieces and a specific texture/presentation.",
      "common_tools": ["knife", "cutting_board", "mandoline_optional"],
      "signals_of_success": ["thin uniform strips", "similar length"],
      "common_mistakes": [
        "uneven thickness",
        "unsafe knife/mandoline handling"
      ],
      "aliases": ["julienne", "matchstick", "cut into strips"],
      "tags": ["knife_skills", "presentation", "quick_cook"]
    },
    {
      "id": "prep_grate",
      "label": "Grate",
      "category": "prep",
      "difficulty": "beginner",
      "definition": "Shred or reduce an ingredient into small fragments using a grater.",
      "why_it_matters": "Increases surface area for faster melting, dissolving, or flavor release.",
      "common_tools": ["box_grater", "microplane"],
      "signals_of_success": ["fine shreds", "minimal waste"],
      "common_mistakes": ["grating knuckles", "using wrong grater size"],
      "aliases": ["grate", "grated", "shred finely", "microplane"],
      "tags": ["texture", "flavor_release"]
    },
    {
      "id": "prep_zest",
      "label": "Zest",
      "category": "prep",
      "difficulty": "beginner",
      "definition": "Remove only the colored outer peel of citrus (avoid bitter white pith).",
      "why_it_matters": "Adds bright aromatic oils without extra liquid.",
      "common_tools": ["microplane", "zester"],
      "signals_of_success": ["bright fragrant zest", "no white pith"],
      "common_mistakes": ["including pith", "over-zesting in one spot"],
      "aliases": ["zest", "zested", "citrus zest"],
      "tags": ["aroma", "finishing"]
    },

    {
      "id": "heat_preheat",
      "label": "Preheat",
      "category": "heat",
      "difficulty": "beginner",
      "definition": "Bring an oven, pan, or oil to the target temperature before cooking.",
      "why_it_matters": "Prevents sticking, improves browning, and stabilizes cooking time.",
      "common_tools": ["oven", "skillet", "thermometer_optional"],
      "signals_of_success": ["pan hot before food", "oven at set temperature"],
      "common_mistakes": [
        "adding food too early",
        "overheating oil until smoking"
      ],
      "aliases": ["preheat", "heat until hot", "bring to temperature"],
      "tags": ["timing", "browning"]
    },
    {
      "id": "heat_simmer",
      "label": "Simmer",
      "category": "heat",
      "difficulty": "beginner",
      "definition": "Cook in liquid at gentle bubbling (small bubbles, not a rolling boil).",
      "why_it_matters": "Develops flavor without breaking delicate ingredients or making meat tough.",
      "common_tools": ["pot", "stove"],
      "signals_of_success": ["small steady bubbles", "gentle movement"],
      "common_mistakes": ["boiling hard", "not stirring when needed"],
      "aliases": ["simmer", "gentle simmer", "low simmer"],
      "tags": ["sauces", "stews"]
    },
    {
      "id": "heat_boil",
      "label": "Boil",
      "category": "heat",
      "difficulty": "beginner",
      "definition": "Cook in liquid at vigorous bubbling.",
      "why_it_matters": "Cooks pasta, grains, and vegetables quickly and predictably.",
      "common_tools": ["pot", "stove"],
      "signals_of_success": ["rolling bubbles", "steam release"],
      "common_mistakes": ["boiling over", "not salting water for pasta"],
      "aliases": ["boil", "rolling boil", "bring to a boil"],
      "tags": ["pasta", "grains", "blanching"]
    },
    {
      "id": "heat_blanch",
      "label": "Blanch",
      "category": "heat",
      "difficulty": "intermediate",
      "definition": "Briefly boil, then quickly cool (often in ice water) to stop cooking.",
      "why_it_matters": "Sets color, loosens skins, and partially cooks for later steps.",
      "common_tools": ["pot", "slotted_spoon", "ice_bath"],
      "signals_of_success": ["bright color", "crisp-tender texture"],
      "common_mistakes": ["skipping ice bath", "over-blanching"],
      "aliases": ["blanch", "parboil then chill", "boil briefly"],
      "tags": ["vegetables", "prep"]
    },
    {
      "id": "heat_steam",
      "label": "Steam",
      "category": "heat",
      "difficulty": "beginner",
      "definition": "Cook with moist heat from steam without submerging in water.",
      "why_it_matters": "Preserves nutrients and delicate textures.",
      "common_tools": ["steamer_basket", "pot", "lid"],
      "signals_of_success": ["tender texture", "minimal waterlogging"],
      "common_mistakes": ["letting pot run dry", "overcrowding steamer"],
      "aliases": ["steam", "steamed"],
      "tags": ["healthy", "gentle_cooking"]
    },

    {
      "id": "saute",
      "label": "Sauté",
      "category": "stovetop",
      "difficulty": "beginner",
      "definition": "Cook quickly in a hot pan with a small amount of fat, stirring or tossing.",
      "why_it_matters": "Builds flavor and texture through light browning.",
      "common_tools": ["skillet", "spatula", "oil"],
      "signals_of_success": ["light browning", "no steaming puddles"],
      "common_mistakes": ["crowding pan", "heat too low causing steaming"],
      "aliases": ["saute", "sauté", "pan fry lightly", "cook in a little oil"],
      "tags": ["browning", "aromatics"]
    },
    {
      "id": "stir_fry",
      "label": "Stir-fry",
      "category": "stovetop",
      "difficulty": "intermediate",
      "definition": "Cook quickly over very high heat while stirring constantly, usually in small batches.",
      "why_it_matters": "Keeps vegetables crisp and develops wok hei (toasty aroma) when done right.",
      "common_tools": ["wok", "high_heat_spatula", "oil_high_smoke_point"],
      "signals_of_success": [
        "crisp-tender veg",
        "no soggy pooling",
        "toasty aroma"
      ],
      "common_mistakes": [
        "overcrowding",
        "low heat",
        "adding wet ingredients too early"
      ],
      "aliases": ["stir fry", "stir-fry", "wok fry"],
      "tags": ["high_heat", "quick_cook"]
    },
    {
      "id": "pan_fry",